{
  "id": "core:soup_portion_cup",
  "name": "죽 배분잔",
  "concept": "낭비되는 분량을 줄여 다음 교대분을 남긴다. 배분 대기 시간이 생겨 즉시 징집에는 불리하다.",
  "tags": [
    "people",
    "food"
  ],
  "designStatus": "s4-runtime",
  "implementationNote": "첫 플레이 가능판: people 태그 장비 보유 시 worker-incoming-damage -1 실제 효과. 해당 태그 무기/도구 및 대상에만 적용.",
  "loopLinks": [
    {
      "estateId": "core:sprout_march",
      "stage": "food",
      "reason": "식량을 인구 유지로 옮기는 효율과 빠른 병력 집결을 교환한다."
    }
  ],
  "effect": {
    "trigger": "급식 국자가 일꾼에게 식량을 나눌 때",
    "benefit": "낭비되는 분량을 줄여 다음 교대분을 남긴다.",
    "cost": "배분 대기 시간이 생겨 즉시 징집에는 불리하다."
  },
  "linkedToolIds": [
    "core:soup_ladle"
  ],
  "runtimeProjection": {
    "requiredTags": [
      "people"
    ],
    "effects": [
      {
        "id": "core:soup_portion_cup_bonus",
        "trigger": "modifier",
        "operation": "stat-add",
        "subject": "worker-incoming-damage",
        "amount": -1,
        "radius": 1000,
        "durationTicks": 0,
        "foodCost": 0,
        "conditions": [
          {
            "kind": "owned-tag",
            "value": "people",
            "minimum": 0
          }
        ]
      }
    ]
  },
  "kind": "item"
}
