{
  "id": "core:bitter_seed_dust",
  "name": "쓴 씨앗 가루",
  "concept": "먹힌 자리에 기피 흔적을 남겨 뒤따른 적의 경로를 틀어 놓는다. 첫 씨앗의 손실은 막지 못한다.",
  "tags": [
    "land",
    "control"
  ],
  "designStatus": "s4-runtime",
  "implementationNote": "첫 플레이 가능판: land 태그 장비 보유 시 attack-damage 2 실제 효과. 해당 태그 무기/도구 및 대상에만 적용.",
  "loopLinks": [
    {
      "estateId": "core:sprout_march",
      "stage": "growth",
      "reason": "손실 뒤의 대응 시간을 벌지만 같은 밭에서 즉시 수확을 기대할 수 없다."
    }
  ],
  "effect": {
    "trigger": "새로 심은 씨앗을 먹는 적이 나타날 때",
    "benefit": "먹힌 자리에 기피 흔적을 남겨 뒤따른 적의 경로를 틀어 놓는다.",
    "cost": "첫 씨앗의 손실은 막지 못한다."
  },
  "linkedToolIds": [
    "core:poison_sickle"
  ],
  "runtimeProjection": {
    "requiredTags": [
      "land"
    ],
    "effects": [
      {
        "id": "core:bitter_seed_dust_bonus",
        "trigger": "modifier",
        "operation": "stat-add",
        "subject": "attack-damage",
        "amount": 2,
        "radius": 1000,
        "durationTicks": 0,
        "foodCost": 0,
        "conditions": [
          {
            "kind": "owned-tag",
            "value": "land",
            "minimum": 0
          },
          {
            "kind": "equipment-tag",
            "value": "land",
            "minimum": 0
          }
        ]
      }
    ]
  },
  "kind": "item"
}
